{
  "$schema": "../schema/house.schema.json",
  "name": "Split-level example house",
  "description": "Three-storey split-level house with six half floors around one open staircase, a sloped concrete roof and a south-facing garden. Measurements are estimates taken from photos.",
  "location": { "lat": 40.42, "lon": -3.70, "utcOffsetHours": 1, "daylightSaving": "eu", "dayOfYear": 294 },
  "orientation": { "backFacadeAzimuthDeg": 190, "note": "Derived from the solar panels: they face south rotated 10 degrees west with a 20 degree tilt, which only matches the garden-side roof pitch." },
  "footprint": { "width": 6.4, "depth": 10.8 },
  "roof": {
    "type": "gable",
    "ridgeZ": 5.4, "ridgeY": 9.7, "eaveFrontY": 6.6, "eaveBackY": 8.0,
    "overhang": 0.4, "material": "concrete",
    "gableWindows": [ { "facade": "front", "x": 3.25, "y": 5.85 }, { "facade": "back", "x": 3.25, "y": 7.25 } ]
  },
  "stairs": { "frontLaneX": 4.92, "backLaneX": 5.66, "laneWidth": 0.72, "z0": 4.4, "z1": 6.4, "steps": 7 },
  "rooms": [
    {
      "id": "kitchen", "name": "Kitchen", "y": 0, "height": 2.8, "x0": 0, "x1": 6.4, "z0": 0, "z1": 5.4, "floor": "tile",
      "door": { "x": 3.9, "z": 4.38, "swing": 1, "color": "#2F3A33" },
      "thermal": { "capacityKwhPerK": 1.6, "uaKwPerK": 0.04, "stratificationK": 0 },
      "temperatureEntity": "climate.kitchen_radiator"
    },
    {
      "id": "living", "name": "Living room", "y": 1.4, "height": 2.8, "x0": 0, "x1": 6.4, "z0": 5.4, "z1": 10.8, "floor": "wood",
      "door": { "x": 3.9, "z": 6.42, "swing": -1, "color": "#EDE3D2" },
      "thermal": { "capacityKwhPerK": 2.2, "uaKwPerK": 0.05, "stratificationK": 0, "solarGainKw": 0.9, "solarFacade": "back" },
      "temperatureEntity": "climate.living_room_ac"
    },
    {
      "id": "kids", "name": "Kids' room", "y": 2.8, "height": 2.8, "x0": 0, "x1": 6.4, "z0": 0, "z1": 5.4, "floor": "wood",
      "door": { "x": 3.9, "z": 4.38, "swing": 1, "color": "#E07A5F" },
      "thermal": { "capacityKwhPerK": 1.4, "uaKwPerK": 0.035, "stratificationK": 0.3 },
      "temperatureEntity": "climate.kids_room_radiator"
    },
    {
      "id": "playroom", "name": "Playroom", "y": 4.2, "height": 2.8, "x0": 0, "x1": 6.4, "z0": 5.4, "z1": 10.8, "floor": "wood",
      "door": { "x": 3.9, "z": 6.42, "swing": -1, "color": "#F2C14E" },
      "thermal": { "capacityKwhPerK": 1.4, "uaKwPerK": 0.035, "stratificationK": 0.2, "solarGainKw": 0.35, "solarFacade": "back" },
      "temperatureEntity": "climate.playroom_ac"
    },
    {
      "id": "attic", "name": "Attic bedroom", "y": 5.6, "underRoof": true, "x0": 0, "x1": 6.4, "z0": 0, "z1": 5.4, "floor": "wood",
      "door": { "x": 3.9, "z": 4.38, "swing": 1, "color": "#C9573F" },
      "thermal": { "capacityKwhPerK": 1.0, "uaKwPerK": 0.02, "stratificationK": 0.6,
                   "roofMass": { "capacityKwhPerK": 3.0, "couplingKwPerK": 0.25, "lossKwPerK": 0.03 } },
      "temperatureEntity": "climate.attic_radiator"
    },
    {
      "id": "office", "name": "Office", "y": 7.0, "underRoof": true, "x0": 0, "x1": 6.4, "z0": 5.4, "z1": 10.8, "floor": "wood",
      "door": { "x": 3.9, "z": 6.42, "swing": -1, "color": "#EDE3D2" },
      "thermal": { "capacityKwhPerK": 0.9, "uaKwPerK": 0.02, "stratificationK": 0.4, "solarGainKw": 0.1, "solarFacade": "back",
                   "roofMass": { "capacityKwhPerK": 2.5, "couplingKwPerK": 0.15, "lossKwPerK": 0.03 } },
      "temperatureEntity": "climate.office_radiator"
    }
  ],
  "walls": [
    { "x0": 0, "x1": 4.9, "z": 5.4, "y0": 0, "height": 1.4 },
    { "x0": 0, "x1": 4.9, "z": 5.4, "y0": 1.4, "height": 1.4 }
  ],
  "windows": [
    { "facade": "front", "x": 1.85, "y": 0.95, "w": 1.9, "h": 1.0 },
    { "facade": "front", "x": 3.45, "y": 3.7, "w": 1.3, "h": 1.0 },
    { "facade": "back", "x": 3.2, "y": 1.42, "w": 4.6, "h": 2.1 },
    { "facade": "back", "x": 1.5, "y": 5.1, "w": 1.2, "h": 1.0 },
    { "facade": "back", "x": 4.3, "y": 5.1, "w": 1.2, "h": 1.0 }
  ],
  "devices": [
    { "type": "ac", "id": "ac_living", "room": "living", "pos": [1.4, 3.85, 5.53], "facing": "+z", "powerKw": 3.0, "sensorBiasK": 0, "runBiasK": 0.4, "surplus": true, "entity": "climate.living_room_ac" },
    { "type": "ac", "id": "ac_kids", "room": "kids", "pos": [6.25, 5.05, 2.5], "facing": "-x", "powerKw": 2.5, "sensorBiasK": 0.3, "runBiasK": 1.0, "surplus": true, "entity": "climate.kids_room_ac" },
    { "type": "ac", "id": "ac_play", "room": "playroom", "pos": [0.15, 6.85, 8.6], "facing": "+x", "powerKw": 2.5, "sensorBiasK": 0.2, "runBiasK": 0.6, "surplus": false, "entity": "climate.playroom_ac" },
    { "type": "ac", "id": "ac_attic", "room": "attic", "pos": [0.15, 7.5, 3.2], "facing": "+x", "powerKw": 3.5, "sensorBiasK": 0.6, "runBiasK": 0.6, "surplus": true, "entity": "climate.attic_ac" },
    { "type": "radiator", "id": "rad_kitchen", "room": "kitchen", "pos": [2.2, 0.06, 0.13], "facing": "+z", "fins": 10, "powerKw": 1.6, "entity": "climate.kitchen_radiator", "heatingPowerEntity": "sensor.kitchen_heating_power" },
    { "type": "radiator", "id": "rad_kids", "room": "kids", "pos": [3.4, 2.86, 0.13], "facing": "+z", "fins": 9, "powerKw": 1.2, "entity": "climate.kids_room_radiator", "heatingPowerEntity": "sensor.kids_room_heating_power" },
    { "type": "radiator", "id": "rad_play_1", "room": "playroom", "pos": [1.5, 4.26, 10.67], "facing": "-z", "fins": 9, "powerKw": 1.0 },
    { "type": "radiator", "id": "rad_play_2", "room": "playroom", "pos": [4.3, 4.26, 10.67], "facing": "-z", "fins": 9, "powerKw": 1.0 },
    { "type": "radiator", "id": "rad_attic", "room": "attic", "pos": [3.3, 5.66, 0.13], "facing": "+z", "fins": 10, "powerKw": 1.5, "entity": "climate.attic_radiator", "heatingPowerEntity": "sensor.attic_heating_power" },
    { "type": "radiator", "id": "rad_office", "room": "office", "pos": [3.2, 7.06, 10.67], "facing": "-z", "fins": 8, "powerKw": 1.0, "entity": "climate.office_radiator", "heatingPowerEntity": "sensor.office_heating_power" }
  ],
  "heating": {
    "radiatorSchedule": [ { "from": 0, "to": 6.5, "setpoint": 16.5 }, { "from": 6.5, "to": 8, "setpoint": 19.5 }, { "from": 8, "to": 20, "setpoint": 16 }, { "from": 20, "to": 22, "setpoint": 19 }, { "from": 22, "to": 24, "setpoint": 16.5 } ],
    "acSetpoint": 22,
    "acCop": 3.5,
    "surplusUntilHour": 18
  },
  "solarPanels": { "roofSide": "back", "rows": 2, "cols": 4, "panelWidth": 1.13, "panelLength": 2.26, "panelWatt": 540, "azimuthDeg": 190, "tiltDeg": 20,
                   "lossesPct": 14, "inverterKw": 4.0, "batteryKwh": 5, "climate": "sunny-south" },
  "climate": { "outdoorMaxC": 20, "outdoorSwingK": 11, "start": { "kitchen": 19.5, "living": 20, "kids": 19.4, "playroom": 19.5, "attic": 18.7, "office": 19.0 } },
  "furniture": [
    { "type": "box", "x": 0, "y": 0, "z": 0, "w": 3.0, "h": 0.9, "d": 0.6, "color": "#6B4430" },
    { "type": "box", "x": 0.03, "y": 0.9, "z": 0, "w": 2.94, "h": 0.05, "d": 0.62, "color": "#F2EBDD" },
    { "type": "box", "x": 0, "y": 1.55, "z": 0, "w": 3.0, "h": 0.65, "d": 0.35, "color": "#6B4430" },
    { "type": "box", "x": 3.0, "y": 0, "z": 0, "w": 0.75, "h": 1.9, "d": 0.65, "color": "#F2F2EE" },
    { "type": "box", "x": 1.7, "y": 0, "z": 2.3, "w": 1.5, "h": 0.9, "d": 0.8, "color": "#8A5A3A" },
    { "type": "box", "x": 1.65, "y": 0.9, "z": 2.25, "w": 1.6, "h": 0.06, "d": 0.9, "color": "#F2EBDD" },
    { "type": "box", "x": 0.2, "y": 1.4, "z": 7.9, "w": 0.95, "h": 0.42, "d": 2.5, "color": "#4F8A80" },
    { "type": "box", "x": 0.2, "y": 1.82, "z": 7.9, "w": 0.25, "h": 0.42, "d": 2.5, "color": "#4F8A80" },
    { "type": "box", "x": 1.1, "y": 1.4, "z": 6.5, "w": 1.7, "h": 0.75, "d": 0.95, "color": "#D9A266" },
    { "type": "rug", "x": 1.3, "y": 1.41, "z": 8.0, "w": 2.2, "d": 1.7, "color": "#E7D4B5" },
    { "type": "box", "x": 1.6, "y": 1.4, "z": 8.3, "w": 0.7, "h": 0.36, "d": 1.0, "color": "#B98A56" },
    { "type": "box", "x": 5.9, "y": 1.4, "z": 8.6, "w": 0.45, "h": 0.5, "d": 1.4, "color": "#F6F0E4" },
    { "type": "box", "x": 6.0, "y": 1.9, "z": 8.9, "w": 0.08, "h": 0.55, "d": 0.85, "color": "#2B2F33" },
    { "type": "box", "x": 1.2, "y": 1.4, "z": 9.6, "w": 0.8, "h": 0.45, "d": 0.8, "color": "#F2A9B8" },
    { "type": "plant", "x": 5.7, "y": 1.4, "z": 10.3, "scale": 1.5 },
    { "type": "bed", "x": 0.15, "y": 2.8, "z": 1.25, "w": 0.95, "d": 1.95, "color": "#F7D35E" },
    { "type": "bed", "x": 1.2, "y": 2.8, "z": 0.15, "w": 1.95, "d": 0.95, "color": "#F7D35E" },
    { "type": "rug", "x": 2.5, "y": 2.81, "z": 1.3, "w": 2.2, "d": 1.6, "pattern": "check" },
    { "type": "box", "x": 4.9, "y": 2.8, "z": 1.4, "w": 0.8, "h": 0.55, "d": 0.6, "color": "#F7D35E" },
    { "type": "box", "x": 4.4, "y": 2.8, "z": 1.5, "w": 0.4, "h": 0.42, "d": 0.4, "color": "#E0483C" },
    { "type": "plant", "x": 5.6, "y": 2.8, "z": 4.0, "scale": 1.1 },
    { "type": "bed", "x": 0.2, "y": 4.2, "z": 8.5, "w": 1.5, "d": 1.95, "color": "#9A7ADB" },
    { "type": "rug", "x": 2.4, "y": 4.21, "z": 8.0, "w": 2.4, "d": 1.7, "pattern": "stars" },
    { "type": "box", "x": 3.2, "y": 4.2, "z": 7.45, "w": 1.2, "h": 1.2, "d": 0.4, "color": "#FFFFFF" },
    { "type": "bed", "x": 3.8, "y": 5.6, "z": 0.9, "w": 1.65, "d": 2.0, "color": "#7E57C2" },
    { "type": "box", "x": 3.3, "y": 5.6, "z": 0.4, "w": 0.38, "h": 0.5, "d": 0.38, "color": "#B98A56" },
    { "type": "box", "x": 5.6, "y": 5.6, "z": 0.4, "w": 0.38, "h": 0.5, "d": 0.38, "color": "#B98A56" },
    { "type": "box", "x": 1.0, "y": 5.6, "z": 4.4, "w": 1.4, "h": 2.0, "d": 0.6, "color": "#FFFFFF" },
    { "type": "plant", "x": 0.6, "y": 5.6, "z": 1.0, "scale": 1.5 },
    { "type": "box", "x": 2.6, "y": 7.0, "z": 9.6, "w": 1.8, "h": 0.06, "d": 0.65, "color": "#FFFFFF", "lift": 0.74 },
    { "type": "box", "x": 3.25, "y": 7.8, "z": 10.05, "w": 0.75, "h": 0.45, "d": 0.05, "color": "#24282B" },
    { "type": "box", "x": 3.4, "y": 7.0, "z": 8.9, "w": 0.45, "h": 0.48, "d": 0.45, "color": "#2B2F33" },